id,Title,Content,Categories
4470,"Gold, Oil & Currency - 28th April","Oil price tumbles amid continued supply, drop in demand and storage woes",Global
4533,"In how many days does COVID-19 Confirmed cases doubles in GCC Countries?","Check our latest chart on COVID-19: Number of days in which confirmed COVID cases are doubling in GCC.","GCC Region"
4537,"GCC Doubling time and Fatality rate","COVID-19: Which GCC Countries are faring better with lower fatality rates and high number of days required to double?","GCC Region"
4539,"Most of the GCC REITs are trading at 52 week lows","REITs have been hit hard on expectations of lower occupancy and falling rents amid lockdown.","GCC Region"
4543,"Impact on different Banking services due to COVID-19","How Covid-19 is affecting banking services?",Global
4579,"Monetary policy action by GCC Central Banks in response to COVID-19","With GCC Central Banks in action Interest Rates cut and Financial Stimulus were announced. Find out the quantum of support provided so far.","GCC Region"
4620,"Revision to GCC’s 2020 Fiscal Forecasts due to change in oil prices and COVID-19","COVID19 and volatility in oil prices make the outlook for GCC uncertain. How have it impacted the IMF's 2020 forecasts for the region? ","GCC Region"
4649,"GCC Quarterly IPO activity, 2013-2019","Managing and exiting investments made by Private Equity and Venture Capital is a key hurdle stifling the growth of the industry. IPOs remain a less frequent exit route for GCC SMEs.","GCC Region"
4709,"Share prices of GCC REITs compared with 52 week highs and lows","COVID19 Impact: Most of the REITs in GCC are trading near their 52-week lows, what are the performance expectations in the short term?","GCC Region"
4782,"Global COVID-19 confirmed cases are accelerating","While April glimpsed just 2 days of more than 100,000 daily new cases globally, May spotted it for 8 days, and June all along; Is 100,000 daily cases a new normal? ",Global
4839,"GCC COVID-19 daily new cases and deaths trend","Will UAE soon be hailed triumphant in winning the fight against COVID-19; the country’s daily cases and deaths dives down in contrast to elsewhere in GCC.","GCC Region"
4997,"Return Expectations for the next 10 years for Global markets","COVID-19 has revised long term equity return expectations for global markets. What can we expect for Saudi equities?",Global
4998,"Results of Socila Media Poll - Return expectation for Saudi Arabia 2020-2024","We conducted a poll in Saudi Equity returns, here are the results!
How important is it to develop equity market returns platform for Saudi Arabia, read our article","Saudi Arabia"
5053,"GCC Countries comparison of Testing and number of cases per million","On a per million population basis UAE fairs the best both in terms of tests conducted and least number of confirmed cases reported. How does other GCC Countries fare on these parameters?","GCC Region"
5147,"Investor risk appetite has improved in the GCC region","Market volatility & sovereign spreads have eased as risk appetite has returned in the GCC region.","GCC Region"
5163,"Covid unable to infect Tesla","Tesla on top gear as its equity shares witness strong rally despite coronavirus disruption",Global
5178,"Performance of Global Sector Indices","Investors pile on technology sector as COVID-19 pandemic accelerates shift to a more digital world",Global
5189,"Performance of Commodities","In the current Covid chaos, Gold is a clear winner",Global
5195,"Performance of U.S Tech Giants","U.S tech giants trounce economic catastrophe to emerge as clear winners.",Global
5253,"Performance of Travel & Hospitality Stocks","Coronavirus has taken its toll on travel industry. Airlines and hotels struggle to survive",Global
5306,"Performance of Global Market Indices","China and U.S stocks recover from COVID-19 effects faster than others. UK, France and Italy lags.",Global
5445,"Performance of U.S 10-year Treasury Bond","US treasury yield moves lower as US Fed holds interest rates steady",Global
5491,"GCC COVID-19 mobility trends","While GCC mobility recovered from the May's drop, it has remained relatively flat in June and July indicating a slow or plateaued recovery","GCC Region"
5502,"Performance of GCC Sovereign CDS Spreads","GCC Sovereign CDS spreads ease as economic conditions improve","GCC Region"
5627,"Evolution of Cost of Capital in the GCC","In the GCC region - Cost of capital, a key metric to value investments, has evolved over the years. What has been the impact of COVID-19?","GCC Region"
6154,"Saudi Arabia's export of key items to USA is just a fraction of China's exports to USA, can this change?","Could frictions between U.S. & China be a window of opportunity for KSA.","Saudi Arabia"
6183,"UAE's export of key items to USA is just a fraction of China's exports to USA, can this change?","Could frictions between U.S. & China be a window of opportunity for UAE.","United Arab Emirates"
6187,"In Comparison to China, Kuwait barely exports to the USA. Can this change?","Can trade war between U.S. & China be an opportunity for Kuwait to increase its exports to the USA?",Kuwait
6204,"Qatar's export of key items to USA is just a fraction of China's exports to USA, can this change?","Could frictions between U.S. & China be a window of opportunity for Qatar.",Qatar
6398,"U.S Treasury Yield and GDP Deflator","Could the secular decline in yields survive COVID-19 induced liquidity glut? ",Global
6445,"Saudi Arabia Treasury Yield & GDP Deflator","Could higher inflation threaten the splendid rally in KSA Sovereign bonds?","Saudi Arabia"
6448,"Qatar Treasury Yield & GDP Deflator","Investors lap up Qatar sovereign bonds as yields plummet. How low could the yields go?",Qatar
6449,"Market Performance","Market Performance","GCC Region"
6922,"Kuwait - Daily New Covid Cases","Did you know? 
Kuwait is facing a more acute second wave of COVID19",Kuwait
6924,"Kuwait population by Age, 2019","Kuwait population pyramid-untypical bulge",Kuwait
6926,"Saudi Arabia Economic Indicators","Services dominate in Saudi GDP as much as Oil","Saudi Arabia"
6929,"UAE – Daily New Covid Cases","Did you know: UAE faces an acute second wave of the virus, which peaked in February and have since subsided.","United Arab Emirates"
6932,"KSA Fiscal Position, Debt & Reserves","The fiscal triangle of Saudi Arabia: Higher deficit, higher debt, and lower reserves.","Saudi Arabia"
6940,"India Covid-19 Daily New Cases","Did you know: India faces an acute second wave of the virus, which is much steeper and yet to peak.",Global
6943,"UAE Economic Activity, GDP","UAE enjoys a diversified services sector.","United Arab Emirates"
6951,"Banking Indicators - UAE","Banking assets in UAE are twice as much as its GDP","United Arab Emirates"
6953,"Qatar Covid-19 Daily New Cases","Did you know: Post steep first wave of the virus, the second wave is yet building up in Qatar.",Qatar
6957,"Bahrain Covid-19 Daily New Cases","Did you know: In Bahrain, current new COVID-19 cases as a percentage of earlier peak is at 1.21x.",Bahrain
6959,"UAE Trade Statistics","UAE imports the most from China and India, while India is its top export destination as well.","United Arab Emirates"
6962,"USA Covid-19 Daily New Cases","Did you know: While most of the nations are into second wave of COVID-19, USA is about to have a 4th wave. Each subsequent wave had a new higher peak as the second wave peak was 1.11 times higher than the first wave peak, and third wave peak was 2.96 times higher than the second wave.",Global
6965,"Ease of Doing Business Rankings - UAE","Starting a business, getting credit, and protecting minority interest witnessed major improvements, resulting in significant improvement in UAE's Ease of Doing Business Rankings.","United Arab Emirates"
6970,"GCC Labour Market","Saudi Arabia, Bahrain, and Oman has better representation of Nationals working in the private sector, whereas other GCC countries lag.","GCC Region"
6972,"UK Covid-19 Daily New Cases","Did you know: UK just got over its second wave which had a peak higher by 12.4 times compared to it's first wave. Would UK see another wave in 2021?",Global
6978,"Qatar Global Competitiveness Ranking","Qatar showed substantial improvement in ICT adoption, but faltered on other parameters which led to drop in its global competitiveness ranking.",Qatar
6980,"GCC Total Cases per million","Did you know: On COVID-19 Cases per Million basis - Bahrain is the worst affected country in the GCC, while Saudi Arabia has managed really well to contain the spread.
","GCC Region"
6983,"GCC - New Covid-19 Tests Performed per Thousand People","Did you know: UAE leads in terms of testing more people for COVID-19, followed by Bahrain. Other GCC countries are yet to catch up. ","GCC Region"
6993,"GCC's Fiscal Breakeven Oil Price","Oil prices are back to pre-covid levels and are cushioning the borrowing requirements of the region. ","GCC Region"
6996,"Germany new COVID-19 cases","Did you know: As Germany weathers the third wave of COVID-19 it has imposed strict lockdown measures to contain the spread. ",Global
6999,"GCC Current Account Balance (% GDP)"," Except UAE, all other GCC nations are expected to post a negative current account balance. ","GCC Region"
7005,"Italy new COVID-19 cases","Did you know: In Italy (currently in third wave), any region with more than 250 COVID cases per 100,000 is placed under ""red"" category meaning bars, restaurants and schools must close. ",Global
7016,"France new COVID-19 cases","Did you know: France might have crossed the peak of the third wave of the Covid-19 pandemic, as schools would open and restrictions confining people to a 10-kilometre (six-mile) radius of their homes would be dropped from May 3",Global
7023,"Ease of Doing Business","Except UAE, Ease of doing Business rankings improved for all other GCC countries in 2020","GCC Region"
7118,"Global Competitiveness","In 2020, all GCC nations witnessed improvement in Global Competitiveness rankings, except Oman.","GCC Region"
7120,"GCC New COVID-19 cases per million","Did you know: Only Qatar and UAE managed to bring down their new COVID-19 reported cases on a per million people bases, while there has been slight deterioration for other GCC nations in the month of April.","GCC Region"
7126,"% of GCC Population infected with COVID-19","Did you know: Despite being the most populous country in the GCC region, only 1.2% of the total population was infected with COVID-19 virus in Saudi Arabia, while in Bahrain about 10.4% of the population was infected with the virus.","GCC Region"
7133,"% of Population Vaccinated","Did you know: USA is one of the most active nations in terms of vaccination drive as it is close to vaccinate about one-third of its population against COVID-19 virus.
",Global
7728,"Weight of Countries in MSCI EM Index","GCC countries have low weightage in MSCI EM Index compared to leading emerging markets",Global
7750,"MSCI EM Index by Sector","Energy sector has low weightage in MSCI EM Index impacting GCC stocks",Global
7818,"Weightage in MSCI EM in %","Top GCC Companies in the MSCI EM Index",Global
8153,"Cost of Capital for GCC Countries - H1 2021","Cost of capital under the three methods with average","GCC Region"
8448,"Saudi Arabia Healthcare Spending","Saudi Arabia has been consistently increasing healthcare spending in recent years, though it lags behind developed economies on a per-capita basis.","Saudi Arabia"
8474,"Kuwait A Popular Luxury Retail Destination","Affluent population and increasing consumer spending augur well for Kuwait as a leading luxury retail destination",Kuwait
8477,"Covid-19 Impacted UAE's F&B Sales","COVID-19 impacted UAE’s F&B sales and the sector is expected to recover in the coming five years.","United Arab Emirates"
8480,"Saudi Aramco Largest and Most Profitable Oil Company","Saudi Aramco is not only the largest but also the most profitable oil company in the World
","Saudi Arabia"
8575,"Fiscal breakeven oil price for MENA Oil exporters (USD/bbl)","Oil exporters could accrue gains as OPEC+ resists calls to accelerate production","GCC Region"
8875,"Residential Market Gross Rental Yield (%)","Rental yields in UAE remain relatively high (nearly 6%). High yields incentivize investors who need steady stream of income.","United Arab Emirates"
8889,"Residential Market Price-to-Income Ratio (Years)","UAE residential real estate scores high on affordability quotient as it shifted focus from luxury segment towards affordable projects.","United Arab Emirates"
