id,Title,Content,Categories
152,"Value Traded (In USD Mn)","A 5-year overview of the GCC stock markets’ liquidity (traded value) reveals a falling trend. Saudi Arabia value traded almost halved from over $529 billion in 2014 to a little over $235 billion in 2018, While UAE shed more than 80% of its value from its peak in 2014.","GCC Region"
190,"Real GDP Growth Rate (in %)","The inflation-adjusted GDP growth in all economies of the Arabian Gulf region is poised to gather momentum from this year through 2021. As the infographics shows, Saudi Arabia, Oman and Kuwait are forecast to see a great leap from negative GDP growth in 2017 to a positive one from this year. Oil price stabilization is expected to ease fiscal pressure and enable governments to adopt expansionary fiscal stance that should, in turn, boost GDP growth.","GCC Region"
192,"THINK TANKS IN GCC","These are interesting times in the Gulf as the region is undergoing seismic socio-economic transformation. As the oil-based economies move towards a post-oil future, the role of think tanks to provide the crucial research support as well as the assessment of the effectiveness of these efforts assumes significance. As shown in the chart below, the region is home to some of the leading think tanks which have been making strides in recent years and assisting decision-making. The question now is: What’s the next step in their evolution?","GCC Region"
194,"Kuwait Banks","Kuwait banks ROA and ROE remain fairly strong. ",Kuwait
322,"Apple Sales by Various segments","Strong iPhone sales propel Apple towards landmark trillion dollar market valuation.",Global
757,"Annual pretax income threshold to be in the top 1% of earners","The income of top 1% of earners in a country is often used as a metric to judge its income standards. However, the quantum of income required to be a part of that elite group varies widely between countries. For instance, one needs to earn nearly twice as much in the GCC (on an average) than in the U.S. to make it to the top 1% earners.",Global
759,"Timeline of Saudi Arabia's inclusion In Emerging Market Indices","Global index providers MSCI and FTSE Russell have upgraded Saudi Arabia to Emerging Market status. FTSE Russell will be implementing a five phase transition process with the 5th phase to be completed in March of 2020. MSCI is following a two phase implementation process with the second phase to be completed in August of 2019. How much capital inflow can we expect into Saudi Arabia from the index inclusion?","Saudi Arabia"
761,"Distribution of Expatriate Workforce In Kuwait","The profession wise distribution of Kuwait’s expatriate workforce reveals interesting dynamics. Non-domestic blue collar work comprising labor in mining, construction, manufacturing and transport engages the maximum number of expats at 32%, followed by human and domestic services that employ the unskilled expat population. In what can be viewed as a clear response to Kuwaitization policy, the number of expatriates working in the public sector is the lowest at 0.03 percent.",Kuwait
763,"Expectation of low oil price pose challenge to budgetary Finance For Most GCC States","Low oil price in 2019 could hamper the spending plans of GCC governments.
Fiscal break even oil price for most GCC states is much higher than expectations.","GCC Region"
765,"GCC Stock Market Liquidity","Liquidity has been one of the key issues grappling the GCC stock markets in recent years. In spite of the reforms initiated by Capital Market authorities in the GCC, the turnover ratio has fallen steeply in 2018 for all GCC countries except Bahrain when compared to 2014.","GCC Region"
767,"Do Technology stocks spend money on R&D","What do the spending patterns of FAANG stocks look like? Who spends the most for R&D and which firm spends the most to market their product?",Global
769,"Saudi Aramco Bond Issuance","Debut international bond from Saudi Aramco drew unprecedented interest from yield starved investors.
Order book swelled by 10x and Aramco pulled off a remarkable feat of achieving lower borrowing costs than the Saudi Government.","Saudi Arabia"
771,"Inclusion of GCC Countries to the JPM EMBI will lower the overall risk of the Index","The inclusion of #GCC Fixed Income is a landmark moment and could signal the opening of a new chapter in the regional capital markets. The GCC region with its high reserve levels, investment grade ratings and low volatility offer significant opportunities to reduce risk. Inclusion in the benchmark J.P Morgan Emerging Market Index (JPM EMBI) could lower the overall risk of the index.","GCC Region|Global"
773,"How Competitive are GCC Economies? Doing Business Ranking","At the global rank of 11, the UAE has the most improved score in Ease of Doing Business ranking in the GCC in 2018. The distant second spot is occupied by Bahrain with the global rank of 62. Barring the UAE, all other GCC countries require to significantly adopt large-scale reforms and improve business conditions.","GCC Region"
775,"Kuwait's non-hydrocarbon sector remains resilient as economic growth is on the rise","Kuwait’s economy has been under pressure ever since oil prices fell in 2014, as the slowdown in economic activity took its toll on the non-hydrocarbon sector as well. Supportive fiscal policy in the past few years has seen capital expenditure grow, which has, in turn, helped Kuwait’s non-oil economy to rebound. Continued capital expenditure and structural reforms are expected to provide further impetus to the non-oil sector and supplement its steady growth in the coming years.",Kuwait
777,"GCC Sovereign Bond Yields (10 Yrs)","GCC’s government debt capital market has grown significantly in the last few years. The GCC governments have been among the biggest debt issuers globally, and investors have poured in billions of dollars in regional sovereign bonds. The chart shows comparative yields on 10-year GCC government bonds, with yields on Oman being the highest while Kuwait being the lowest. The bottomline is: With lower volatility and attractive yields, GCC sovereign bonds have emerged as more attractive asset class.","GCC Region"
783,"World's Largest Cities: How the pecking order is changing","The world’s urban population has grown rapidly in the last few decades. What’s more interesting is that future increases in the size of the world’s population are expected to be highly concentrated in just a handful of the world’s largest cities. As the diagram below shows, Asia’s largest cities together will account for around two-third of the overall projected population of world’s 10 largest cities in 2035.",Global
786,"GCC Fiscal Balance ( as a % of GDP)","Stronger oil revenues, pick-up in the non-oil sector growth, and fiscal and structural reforms will help GCC economies to strike a right balance between revenues and expenditure in the near term. As the infographics below shows, most GCC countries are expected to see tangible improvements in their fiscal positions, although they are forecast to remain in negative territory in Saudi Arabia and Bahrain despite the improvement.","GCC Region"
788,"GCC Current Account Balance ( as a % of GDP)","The recent recovery in oil prices and the easing of fiscal consolidation are boosting near-term growth prospects of the GCC economies. Look at the infographics below that explains how their current account balance, as a percentage of GDP, is projected to recover in 2018 and 2019. However, the hard truth is: much of this positive outlook remains subject to volatility in the future course of oil prices.","GCC Region"
791,"GCC Inflation Rate (in %)","GCC countries are projected to see the inflation level hardening in 2018 through 2021 from 2017 level. The recovery in oil prices is encouraging more pro-growth fiscal policies in the GCC, prompting governments to push fiscal spending and expansionary budgeting course. However, this fiscal push coupled with the effects of the VAT and rising fuel prices, runs the risk of fueling inflationary trends. Will rising inflation hurt the regions’ growth prospects?","GCC Region"
794,"Power of Passport - GCC Comparison","Not all passports are the same when it comes to having cross-border access around the globe. The citizens of the #GCC countries are slowly, but surely, becoming more global and more powerful, if their passports are any indication. Take for instance, the holders of the UAE passport who can now travel to 167 countries (the most by any passport holder) without the need for pre-visa requirements. As the diagram below shows, rest of the GCC countries also rank within top 55 passports globally in terms of enjoying visa-free travel.","GCC Region"
796,"GCC's Top Islamic Banks by Assets","The Islamic banking sector continues to grow in size and dominance in the GCC region. Our infographic below takes a peek at the largest Islamic banks in the region based on their assets. Top five banks capture 60% assets share.

Five of the 19 biggest banks are based in Kuwait, 4 each in the UAE and Bahrain, and 3 each in Saudi Arabia and Qatar.","GCC Region"
802,"YTD 2018 Returns of GCC Equity Indices","In many ways the story of the GCC equity markets in 2018 has been the one of two extremes. On one end of the spectrum is Dubai benchmark that remains the biggest drag, on the other end is Qatar that blazed the trail. But then 2 key questions arise: One, have the recent sell-offs made valuations attractive in Dubai and Oman? Two, are some stock market highs in the GCC justified?","GCC Region"
804,"Private Sector Credit Growth (in %)","Subdued oil prices, over the last few years, have impacted private sector credit growth in the GCC region owing to a weak macroeconomic backdrop and muted non-oil economic growth. As the diagram below shows, as oil prices have been rebounding, albeit slowly, this is expected to propel private sector credit growth in 2018 in most of the Arabian Gulf countries except in Qatar. The key question is: Will the stagnant private sector lending weigh on GCC banks and impact their margins?","GCC Region"
808,"3 month Deposit rate in the GCC","The cooling eurozone economy and its easy monetary policy are reflected in the deposit rate (the rate at which banks park funds at the central bank) which is in negative territory. By contrast, higher deposit rates in the US reflect recovery of the American economy. Same is the case in the GCC region which, due to their currencies’ peg to the dollar, follow the US monetary policy. The question is: Will this global monetary policy divergence lead to global imbalances?","GCC Region"
811,"Global Financial Centre Index (GFCI) Rankings","Cities around the world, as well as across the MiddleEast, are encouraging innovation and putting in place best practices in order to differentiate themselves as competition between financial centres intensifies. As shown in the diagram below, New York saw its ranking improve on the Global Financial Centres Index (GFCI) from being second in 2017 to claim the top position this year. Likewise, in the Middle East, Dubai climbed to 15th rank in 2018 on the GFCI, from 19th position in 2017.","GCC Region|Global"
814,"Ease of Doing Business Parameters - Kuwait 2017 - 2019","A comparison of World Bank’s ‘Doing Business’ reports of last three years – 2017, 2018, 2019 -- shows Kuwait has improved, though marginally, on the overall ease of doing business parameter. Performance across sub parameters varies though.",Kuwait
817,"GCC Capital Flows (in USD Bn)","During 2003-2007, the GCC region enjoyed positive capital flows buoyed by high growth and rising oil prices. However, the global financial-crisis in 2009 severely impacted the capital flows as foreign investors withdrew their positions. Consequently, as the chart below shows, since 2013 the region has been seeing the loss of capital. The net capital flows are expected to be negative until 2020, though the gap between resident and non-resident capital flows has been reducing. The question is: Is it capital flight or normal flows?","GCC Region"
819,"Fiscal Breakeven Oil Price","The year-on-year fall in the fiscal breakeven oil price of the UAE, Saudi Arabia, Bahrain and Oman in 2018 are expected to bring relief to them. In contrast, as the diagram shows, the economies of Kuwait and Qatar are likely to continue feeling the pain, as the rise in their fiscal breakeven oil price this year, compared to 2017, is likely to keep their balance sheets under pressure.","GCC Region"
823,"Banking Sector - Risk Return Metrics","Generally speaking, investing in any #asset involves the risk-return tradeoff. This means the higher the risk, the higher the potential return. As shown in the chart below, the 5-year return of different banking stock indices across the GCC has been moving in tandem with the level of risks associated. For instance, Dubai’s banking index offers the highest return, but it also carries the highest risk. Likewise, Kuwait’s banking stocks are least risky but they offer the lowest returns. The bottomline: No pain, no gain.","GCC Region"
825,"Foreign Direct Investment","The softening of #crude oil prices over the last few years has taken a toll on the Foreign Direct Investment (FDI) inflows in the GCC region. This year, however, FDI inflows have so far held up relatively well and are expected to be higher than in 2017. Last year saw FDI in Saudi Arabia, Qatar and Kuwait take a sharp dip compared to 2016. Overall, the UAE continues to lead the pack in the region in terms of attracting highest FDI inflows for the last 3 years, consecutively.","GCC Region"
827,"Saudi 5yr bond yield spread widens against similar rated countries","Going by the conventional metrics used by economists, rising sovereign bond yields flash warning signs for a country’s economic trajectory. Currently, the widening spread between Saudi Arabia’s 5-year bond yields and those of similar rated countries imply higher risk perception among investors about the Kingdom’s economy. The key question: is the widening yield temporary or something that is here to stay?","Global|Saudi Arabia"
829,"Spread Between Saudi Index And MSCI EM P/E TTM","In June 2018, the #Saudi Stock Exchange (Tadawul) had won MSCI Emerging Market (EM) status, after Tadawul fulfilled MSCI’s requirements to join EM index. However, the valuation gap between stocks in Saudi Arabia and EM has been expanding for around a year, and currently, Saudi Arabian stocks are trading at a premium compared to the MSCI EM Index. What’s pushing Saudi stocks’ valuations, and is it a good time for investors?","Global|Saudi Arabia"
831,"Expat Proportion(%) of total population in GCC","These GCC countries have the highest (and lowest) expat-to-local population mix.","GCC Region"
833,"Top 5 Nationalities in Kuwait Labour Market","Revealed: The top 5 nationalities in Kuwait workforce.",Kuwait
835,"Petrol Prices in Selected Emerging Economies","The real cost of filling up: Petrol prices in Emerging Markets &amp; GCC.","GCC Region|Global"
837,"Are GCC Citizens Richer Now?","Guess, which GCC country has the highest, and lowest GDP per capita growth!","GCC Region"
839,"Kuwait Jobs 2017 - Arabic","Kuwait unemployment : Women dominate",Kuwait
841,"Kuwait Jobs 2017","Kuwait unemployment : Women dominate",Kuwait
843,"Turmoil in Turkey","Turkey Economic pains, how will it play out.",Global
845,Bahrain,"Bahrain’s government debt expected to be 85% of GDP in 2018; nearly doubles since 2014.",Bahrain
847,"Global Islamic Bond issuance","Global Islamic Bond issuance was dull, dropped by 15.3% in H1 2018 compared to same period last year.",Global
849,Bahrain,"Bahrain foreign exchange reserves shrink by over 75% since its peak in 2014 of USD 5,758Mn.",Bahrain
853,"Dubai Stocks - Sectoral Performance (YTD 2018)","Consumer &amp; realestate stocks weigh down on Dubai’s market performance.","United Arab Emirates"
855,"Kuwait Banks - Moody's Rating Distribution","Majority of Kuwait banks hold upper medium #investment grade rating by Moody’s.",Kuwait
862,"US Trade Deficit with Trade Partners","US picks on its major trade allies sparking a potential TradeWar.",Global
864,"Bahrain 5-Yr CDS Spreads 2018","Announcement of financial relief from neighbors provides temporary respite for Bahrain.",Bahrain
866,"Saudi Arabia - Oil Revenue As A Part of Total Revenue","SaudiArabia stepping up effort to reduce its reliance on Oil revenues.","Saudi Arabia"
868,"GCC Banking Stock Market Performance","Dubai Banking Index outperform other #GCC banking indices between May 2012 to June 2018.","GCC Region"
870,"Kuwait Listed Banks Stock Market Performance","Kuwait Finance House outperforms other banks in Kuwait during past 5 years till June 2018. ",Kuwait
872,"Kuwait Banks Stock Market Performance","Comparative performance of Kuwait Banks.",Kuwait
874,"New Visa Regime Can the new visa regime maintain GCC economy's competitive edge?","Changing visa rules in the #GCC – Will this help the region retain its competitiveness?","GCC Region"
876,"GCC Bond Markets Signal Tensions","Widening CDS spread indicates brewing financial troubles for Bahrain.",Global
879,"MENA Top 100 Companies",,"Mena Region"
882,"Kuwait Banking","Impact of Fintech, in Kuwait Banking industry.",Kuwait
884,"IPhone Price Index","One iPhone, many nations, different prices.",Global
886,"Royal's Contribution to UK Economy","The Business of Royal Monarchy.",Global
888,"Kuwait - No of Employees and Their wages","Kuwait public sector employee base has grown about 5% every year, while wage bill has risen by about 9%.",Kuwait
890,"Renewable Energy","Renewable energy paves the roadmap for the future of energy across MiddleEast.","GCC Region"
892,"Jabel Ali Free Zone (JAFZA)","JAFZA reaffirmed as key trading hub Trade valued at $83bn (2017); Middle East tops.","United Arab Emirates"
894,"Liquidity in UAE Banks Abundant As of Now","Impact of Fintech, in UAE Banking industry","United Arab Emirates"
896,"Dubai's 3D Printing Strategy","Dubai’s 3D printing infrastructure road-map can prove to be a template to overcome GCC construction sector woes.","United Arab Emirates"
898,"Burgeoning GCC Debt Profile","GCC is actively looking at debt as a source of financing – the trend that was earlier missing.","GCC Region"
900,"Domestic and International Passengers Carried by Airlines in Major Markets","The US, Europe, and China carry far more air passengers than the GCC and India.",Global
902,"GCC Companies in China","GCC Companies footprints in China.","GCC Region|Global"
904,"GCC Companies In India","GCC Companies footprints in India.","GCC Region|Global"
906,"KSA Banking Sector 2018","The fintech revolution is likely to have a significant impact particularly on the retail #banking business in Saudi Arabia . ","Saudi Arabia"
908,"The GCC Ritz-Carlton Index - Price per night","GCC hotel room rates inequality - One hotel brand, different locations, different rates","GCC Region"
910,"GCC Banking Sector 2018","Fintech can disrupt more than 15% business of GCC Banks in next 5 years.","GCC Region"
912,"GCC Conglomerates - Global Footprints","GCC companies have been spreading globally. Let's find out who are those and how deep they penetrate.","GCC Region|Global"
914,"Speed Test Global Index","Which country in the GCC has the top internet Broadband Speed?","GCC Region|Global"
916,"SME Startups","Featuring Successful SME Startups in GCC","GCC Region"
918,"How Brexit Stacks up against the Global Financial Crisis of 2008?",,Global
920,"Saudi Economic Posts Reshuffle","May 2016","Saudi Arabia"
922,"Crisis: Here to Stay","The Known ""Unknowns""!",Global
2045,"Key Players in GCC Sharing Economy","Sharing economy entails collaborative consumption that promotes concepts like community ownership, localized production, growth of small-scale enterprise, improved economic and environmental consciousness. Who are the key players in GCC sharing economy?","GCC Region"
2139,"Ridesharing Platforms Operating in GCC","The GCC region witnessed its biggest tech deal wherein Uber acquired Careem, the most prominent ride sharing player in the region in a deal worth $3.1 billion. What does this reveal about the present and future of ride sharing market in GCC?","GCC Region"
2208,"Online Food Delivery Sites and Apps with Strong Presence across GCC","How are marketing innovations, and lifestyle changes of GCC consumers affecting the business in restaurants and online food ordering and delivery services?","GCC Region"
2210,"M&A Activities in GCC Restaurant tech space","Food delivery services contributed a gross revenue of USD 284.9 million to the GCC economy in 2018. The GCC food delivery sector is lively with a strong growth and multiple M&A deals. Find out about the prominent deals in GCC Restaurant tech - Marmore Research Report.","GCC Region"
2212,"Remittance Charges to India","Qatar, the fifth largest remitter to India, has the highest remittance cost to India among GCC countries.","GCC Region"
2224,"GCC Restaurant tech startups in key segments","With a 77% smart phone penetration in the GCC, the region is witnessing the emergence of a new section of digital customers which has its repercussions across industries. Who are the key food tech startups in the GCC region?","GCC Region"
2260,"Remittance charges to Pakistan","Saudi Arabia, which accounts for the highest remittance inflows into Pakistan, also has the highest remittance cost to Pakistan among GCC countries. ","GCC Region"
2273,"Key Trends in Restaurant Tech","Cooked? Baked? 3D printed? How do you prefer your food? Read about how restaurants across the GCC use enabling technologies to cater to customers. ","GCC Region"
2290,"Oman and Bahrain's spreads widen after downgrade in credit ratings","Here is where the CDS spreads of GCC countries stand in comparison with global peers.","GCC Region|Global"
2311,"Remittance charges to Bangladesh","The UAE, whose remittance outflow to Bangladesh stood at USD 2.4 billion in 2017, has the lowest remittance cost to Bangladesh among GCC countries.","GCC Region"
2317,"Remittance charges to Philippines","Did you know? Saudi Arabia has the highest remittance cost to Philippines among GCC countries.","GCC Region"
2321,"Expat proportion (%) of total population in GCC states","Which countries has the highest expat proportion in GCC.","GCC Region"
2367,"iPhone 11 Pro Max - Price Index (256 GB)","Prices of iPhone across globe, where to buy the next iPhone?",Global
2394,"Power of Passport - GCC Comparison","Passport power for GCC nations status upgraded...","GCC Region"
2516,"Ease of Doing Business Parameters – Kuwait 2018 – 2020","Kuwait jumps 14 points up at ease of doing business released by World bank, How did it fare across parameters?",Kuwait
2584,"Salaries in the Middle East: How they compare across functions?","How salaries differ across designations? What can one expect to draw in the Middle East?","Mena Region"
2596,"Kuwait Banks - Stock Market Performance (2019)","How have Kuwaiti banks fared in 2019?",Kuwait
2704,"What value would Aramco trade at?","Saudi Aramco would start trading from 11th December onwards, post listing what do you think the stock would trade at?","Saudi Arabia"
2729,"GCC Equity Indices 2019 YTD Performance","Kuwait stock market outperforms regional peers with YTD gains of 17% (as of 28th Nov) amid investor euphoria on MSCI’s announcement on reclassification of the Kuwait to emerging market status.","GCC Region|Kuwait"
3029,"Science and Engineering journal articles published per million population, 2018","Most GCC states lag behind world average in Science & Engineering research",Global
3124,"Kuwait - High Growth Sectors (2010 - 2018)","Basic metals and Chemicals – highest growing sector in Kuwait.",Kuwait
3243,"Kuwaiti Economy - Average Growth Sectors (2010 - 2018)","Social work, defense and cultural services sectors witnessed above average growth during 2010-18",Kuwait
3409,"Brokerages call on Saudi Aramco","How much did brokerages value Saudi Aramco post its listing?","Saudi Arabia"
3418,"Sectors with Negative Growth in Kuwait (2010 - 18)","Wood and Food & Beverages de-grew the most during 2010-2018.",Kuwait
3457,"IPOs in GCC Region, 2013 - 2019","Managing and exiting investments made by PE and VC is a key hurdle stifling the growth of the industry. IPOs remain a less frequent exit route for GCC SMEs.","GCC Region"
3637,"GCC PE Firms - Investments transactions by country, 2008-2019","UAE firms have been involved in more PE transactions between 2008 and 2019 than the rest of the GCC combined.","GCC Region"
3688,"Global Powertrain Market Share 2015- 2030","Globally there is a growing shift towards Electric Vehicles (EV). What are the factors driving EV demand and their expected demand in GCC countries.","GCC Region|Global"
3704,"Net Passenger Vehicles Imports by Value","In 2014 Saudi Arabia accounted for the largest share of passenger vehicle market by value in the GCC. How has this changed in 2018? What could be the share over the next 5 years?","GCC Region"
3947,"Exposure of Norway's Sovereign Wealth Fund (SWF) to GCC Equities","UAE and Kuwait dominate Norway’s SWF equity investments in GCC. For 2018-19, value of the investments increased the most in Kuwait","GCC Region"
4246,"GCC Equities face unprecedented fall amid coronavirus","Markets have usually recovered within a year from outbreaks.","GCC Region"
4253,"Previous outbreaks have had lesser impact on Kuwait equities","Has the fall in Kuwait equities from coronavirus (COVID-19) been steeper than previous outbreaks?",Kuwait
4452,"GCC 5year Credit Default Swap (CDS) Spreads","As fears of a global recession have grown GCC sovereign CDS spreads, a key measure of credit risk, have jumped markedly - tripling or quadrupling in some cases.","GCC Region"
4454,"10-year U.S Treasury Yield (%)","Yields stay low as investors flock to safe haven assets.",Global
